    				
Ghosts and Empties	http://www.newyorker.com/magazine/2015/07/20/ghosts-and-empties			"On my nighttime walks the neighbors’ lives reveal themselves, the lit windows domestic aquariums. At times, I’m the silent witness to fights that look like slow-dancing without music. It is astonishing how people live, the messes they sustain, the delicious whiffs of cooking that carry to the street, the holiday decorations that slowly seep into daily décor. All January, I watched a Christmas bouquet of roses on one mantel diminish until the flowers were a blighted shrivel and the water green scum, a huge Santa on a stick still beaming merrily out of the ruins. Window after window nears, freezes with its blue fog of television light or its couple hunched over a supper of pizza, holds as I pass, then slides into the forgotten. I think of the way water gathers as it slips down an icicle’s length, pauses to build its glossy drop, becomes too fat to hang on, plummets down."
Ghosts and Empties	http://www.newyorker.com/magazine/2015/07/20/ghosts-and-empties			"I have somehow become a woman who yells, and, because I do not want to be a woman who yells, whose little children walk around with frozen, watchful faces, I have taken to lacing on my running shoes after dinner and going out into the twilit streets for a walk, leaving the undressing and sluicing and reading and singing and tucking in of the boys to my husband, a man who does not yell."
Ghosts and Empties	http://www.newyorker.com/magazine/2015/07/20/ghosts-and-empties			"On Valentine’s Day, I see red and white lights flashing from afar at the nunnery and walk faster in the hope that the nuns are having a love party, a disco rager, but instead I see an ambulance drive away, and the next day my fears are confirmed: the nuns have been further diminished, to two. Withholding erotic pleasure for the glory of God seems an anachronism in our age of pleasure, and, with their frailty and the hugeness of the house they rattle around in, it has been decided that the remaining nuns must decamp. I come to watch them the night they leave, expecting a moving truck, but there are only a few leather suitcases and a box or two in the back of the nuns’ station wagon. Their wrinkled faces droop with relief as they drive off."
Ghosts and Empties	http://www.newyorker.com/magazine/2015/07/20/ghosts-and-empties			"Now, while I stand before the collapsed house, the woman with the Great Dane slides by through the dark, and I notice how aggressively pale she has become, so skinny her cheeks must touch inside her mouth, her wig askew to show a rind of scalp above the bangs. If she, in turn, notices the particular dark spike of my unrest, she says only a soft good night and her dog looks at me with a kind of human compassion, and together they move off, stately and gentle, into the black."
Ghosts and Empties	http://www.newyorker.com/magazine/2015/07/20/ghosts-and-empties			"There’s the man who hisses nasties as he stands under the light outside a bodega with bars over its windows. I put on my don’t-fuck-with-me face, and he has yet to do more than hiss, but there is a part of me that is more than ready, that wants to use what’s building up."
Ghosts and Empties	http://www.newyorker.com/magazine/2015/07/20/ghosts-and-empties			
Ghosts and Empties	http://www.newyorker.com/magazine/2015/07/20/ghosts-and-empties			"The cold lingers on into March. It has been a hard winter for everyone, though not as terrible as in the North, and I think of my friends and family up there with their dirty walls of snow and try to remember that the camellias and peach trees and dogwoods and oranges are all abloom here, even in the dark. I smell the jasmine potent in my hair the next morning, the way I used to smell cigarette smoke and sweat after going to a night club, back when I was young and could do such unthinkable things. There is a vernacular style of architecture, called Cracker, which is not meant to cause offense, all porches and high ceilings; and by the middle of March one of the oldest Cracker houses in north-central Florida is being renovated. The façade is preserved, but the rest is gutted. Night by night, I see what remains of the house as daily it is stripped away, until one night the house has entirely vanished: that morning it collapsed on a worker, who survived, like Buster Keaton, by standing in the window as the structure fell. I study the hole where a humble and unremarked history stood for so long, a house that watched the town press up, then grow around it, and I think of the construction worker who walked out of the collapse unhurt, what he was imagining. I think I know. One night just before Christmas I came home late after a walk and my husband was in the bathroom and I flipped open his computer and saw what I saw there, a conversation not meant for me, a snip of flesh that was not his, and without letting him know I was in the house I about-faced and went out again and walked until it was too cold to walk, until just before dawn, when the dew could easily have been ice."
Ghosts and Empties	http://www.newyorker.com/magazine/2015/07/20/ghosts-and-empties			"As I walk, I see strangers but also people I know. I look up in the beginning of February to see a close friend in a pink leotard in her window, stretching, but then, with a zip of understanding, I realize that she isn’t stretching, she is drying her legs, and the leotard is in fact her body, pinked from the hot shower. Even though I visited her in the hospital when both of her boys were born, held the newborns in my arms when they still smelled of her, saw the raw Cesarean split, it isn’t until I watch her drying herself that I understand that she is a sexual being, and then the next time we speak I can’t help but blush and endure images of her in extreme sexual positions. Mostly, however, I see the mothers I know in glimpses, bent like shepherdess crooks, scanning the floor for tiny Legos or half-chewed grapes or the people they once were slumped in the corners."
Ghosts and Empties	http://www.newyorker.com/magazine/2015/07/20/ghosts-and-empties			"I hope they understand, my sons, both now and in the future just materializing in the dark, that all these hours their mother has been walking so swiftly away from them I have not been gone, that my spirit, hours ago, slipped back into the house and crept into the room where their early-rising father had already fallen asleep, usually before 8 P.M., and that I touched this gentle man whom I love so desperately and somehow fear so much, touched him on the pulse in his temple and felt his dreams, which are too distant for the likes of me, and I climbed the creaking old stairs and at the top split in two and, heading right and left into separate rooms, slid through the crack under the doors and curled myself on the pillows to breathe into me the breath my boys breathed out. Every pause between the end of one breath and the beginning of the next is long; then again, nothing is not always in transition. Soon, tomorrow, the boys will be men, then the men will leave the house, and my husband and I will look at each other crouching under the weight of all that we wouldn’t or couldn’t yell, and all those hours outside walking, my body, my shadow, and the moon. It is terribly true, even if the truth does not comfort, that if you look at the moon for long enough night after night, as I have, you will see that the old cartoons are correct, that the moon is, in fact, laughing, but not at us, we who are too small and our lives too fleeting for it to give us any notice at all. ?"
Ghosts and Empties	http://www.newyorker.com/magazine/2015/07/20/ghosts-and-empties			"There is one mostly windowless place in the neighborhood, a yellow brick monstrosity that I love nevertheless, because it houses nuns. There used to be six nuns there, but attrition happened, as it does with very old ladies, and now there are only three kindly sisters squeaking around that immense space in their sensible shoes. A Realtor friend told us that when it was built, in the nineteen-fifties, a bomb shelter was lowered into the porous limestone of the back yard, and during sleepless nights, when my body is in bed but my brain is still out walking in the dark, I like to imagine the nuns in full regalia in their shelter, singing hymns and spinning on a stationary bike to keep the light bulb sputtering on, while, aboveground, all has been blasted black and rusted hinges rasp the wind."
Ghosts and Empties	http://www.newyorker.com/magazine/2015/07/20/ghosts-and-empties			"And then there’s the therapist who every night sits at his desk in the study of his Victorian, which looks like a rotting galleon. He was caught in bed with the wife of one of his patients; the patient had a loaded shotgun out in the car. The wife died in coitus and the therapist survived with a bullet still in his hip, which makes him lurch when he gets up to pour himself more Scotch. There are rumors that he visits the cuckolded murderer in prison every week, though whether his motive is kindness or crowing remains in the shadows, as if motives could ever be pure. My husband and I had just moved in when the murder occurred; we were scraping rotting paint off the oak moldings in our dining room when the gunshots splattered the air, but of course we believed they were fireworks lit by the kids who lived a few houses down."
Ghosts and Empties	http://www.newyorker.com/magazine/2015/07/20/ghosts-and-empties			"Northern Florida is cold in January and I walk fast for warmth but also because, although the neighborhood is antique—huge Victorian houses radiating outward into nineteen-twenties bungalows, then mid-century modern ranches at the edges—it’s imperfectly safe. There was a rape a month ago, a jogger in her fifties pulled into the azaleas; and, a week ago, a pack of loose pit bulls ran down a mother with a baby in her stroller and mauled both, though not to death. It’s not the dogs’ fault, it’s the owners’ fault! dog-lovers shouted on the neighborhood e-mail list, and it’s true, it was the owners’ fault, but also those dogs were sociopaths. When the suburbs were built, in the seventies, the historic houses in the center of the town were abandoned to graduate students who heated beans over Bunsen burners on the heart-pine floors and sliced apartments out of ballrooms. When neglect and humidity caused the houses to rot and droop and develop rusty scales, there was a second abandonment, to poor people, squatters. We moved here ten years ago because our house was cheap and had virgin-lumber bones, and because I decided that if I had to live in the South, with its boiled peanuts and its Spanish moss dangling like armpit hair, at least I wouldn’t barricade myself with my whiteness in a gated community. Isn’t it . . . dicey? people our parents’ age would say, grimacing, when we told them where we lived, and it took all my will power not to say, Do you mean black, or just poor? Because it was both."
Ghosts and Empties	http://www.newyorker.com/magazine/2015/07/20/ghosts-and-empties			"Most changes are not so swift as the fallen house, and I notice how much weight the boy in his glassed-in sunporch has lost only when I realize from the sound of his footsteps that he’s no longer walking on his treadmill but running, and I look at him closely for the first time in a long time, my dear flabby friend whom I took for granted, and see a transformation so astonishing it’s as if a maiden had turned into a birch tree or a stream. During these few months this overweight child has turned into a slender man with pectoral rosebuds on his chest, sweating, smiling at himself in the glass, and I yelp aloud because of the swiftness of youth, these gorgeous changes that insist that not everything is decaying faster than we can love it."
Ghosts and Empties	http://www.newyorker.com/magazine/2015/07/20/ghosts-and-empties			"The week of heat proves temporary, a false start to the season. The weather again turns so clammy and cold that nobody else comes out and I shiver as I walk until I escape my chill by going into the drugstore for Epsom salts to soak my walking away. It is astonishing to enter the dazzling color, the ferocious heat after the chilly gray scale; to travel hundreds of miles over the cracked sidewalk and sparse palmetto and black path-crossing cats I dart away from, into this abundance with its aisles of gaudy trash and useless wrapping and plastic pull tabs that will one day end up in the throat of the earth’s last sea turtle. I find myself limping and the limp morphs into a kind of pained bopping because the music dredges up elementary school, when my parents were, astonishingly, younger than I am now, and that one long summer they listened on repeat to Paul Simon singing over springy African drums about a trip with a son, the human trampoline, the window in the heart; and it is both too much and too little and I leave without the salts because I am not ready for such easy absolution as this. I can’t."
Ghosts and Empties	http://www.newyorker.com/magazine/2015/07/20/ghosts-and-empties			"I walk on and as the boy’s trotting noises fade I keep hearing a disquieting constant sound that I can’t place. It is a sticky night: I shed my jacket last week, and it is only gradually that I understand that the noise is coming from the first air-conditioner turned on for the year. Soon they’ll all be on, crouched like trolls under the windows, their collective tuneless hum drowning out the night birds and frogs, and time will leap forward and the night will grow more and more reluctant to descend and, in the cool linger of twilight, people longing for real air after the sickly fake cold all day will come out and I will no longer have my dangerous dark streets to myself. There’s a pleasant smell like campfires in the air, and I think that the old turpentine-pine forests that ring the city must be on fire, which happens once a year or so, and I wonder about all those poor birds seared out of their sleep and into the disorienting darkness. I discover the next morning that it was worse, a controlled burn over the acres where dozens of the homeless had been living in a tent city, and I walk down to look, but it’s all great oaks, lonely and blackened from the waist down in a plain of steaming charcoal. When I return and see the six-foot fences around Bo Diddley Plaza which had gone up that same night for construction, or so the signs say, it is clear that it is part of a larger plan, balletically executed. I stand squinting in the daylight wanting to yell, looking to find a displaced person. Please, I think, please let my couple come by, let me see their faces at last, let me take their arms. I want to make them sandwiches and give them blankets and tell them that it’s O.K., that they can live under my house. I’m glad I can’t find anyone later, when I remember that it is not a kind thing to tell human beings that they can live under your house."
Ghosts and Empties	http://www.newyorker.com/magazine/2015/07/20/ghosts-and-empties			"The neighborhood goes dark as I walk, and a second neighborhood unrolls atop the daytime one. We have few street lights, and those I pass under make my shadow frolic; it lags behind me, gallops to my feet, gambols on ahead. The only other illumination is from the windows in the houses I pass and the moon that orders me to look up, look up! Feral cats dart underfoot, bird-of-paradise flowers poke out of the shadows, smells are exhaled into the air: oak dust, slime mold, camphor."
In the Act of Falling	http://www.newyorker.com/magazine/2015/09/07/in-the-act-of-falling			
In the Act of Falling	http://www.newyorker.com/magazine/2015/09/07/in-the-act-of-falling			"You've read your last complimentary article this month. To read the full article, SUBSCRIBE NOW"
In the Act of Falling	http://www.newyorker.com/magazine/2015/09/07/in-the-act-of-falling			"It was a little after 7 A.M., and outside in the garden her nine-year-old son, Finn, was stringing a tennis net between two trees, stringing it not in the normal fashion, the way one might to play tennis, but horizontally, like a hammock. He was wearing a pair of too short trousers, perhaps the trousers from last year’s school uniform, and no shoes. The grounds on this side of the property were ragged but pretty, bounded by a low stone wall that allowed views across the fields to the gray slate roofs of Portlaoise. “I think it might’ve been a mistake to tell him about the ducks,” Bill said."
Little Man	http://www.newyorker.com/magazine/2015/08/10/little-man			"You refuse to panic, though. You repeat, silently, the spell taught to you by Aunt Farfalee (who is by now no bigger than a badger, with blank white eyes and fingers as thin and stiff as icicles). You concentrate—belief is crucial. One of the reasons that ordinary people are incapable of magic is a simple dearth of conviction."
Little Man	http://www.newyorker.com/magazine/2015/08/10/little-man			"The King gives the miller a glacial look, has a guard escort him away, and withdraws, locking the door behind him."
Little Man	http://www.newyorker.com/magazine/2015/08/10/little-man			"She stares at you. She doesn’t speak. Her life, since this morning, has become so strange to her (she who yesterday was sewing grain sacks and sweeping stray corn kernels from the floor) that the sudden appearance of a twisted and stub-footed man, just under four feet tall, with a chin as long as a turnip, seems merely another in the new string of impossibilities."
Little Man	http://www.newyorker.com/magazine/2015/08/10/little-man			"As you wait, you notice the girl’s father, the miller (the former miller), seated among the members of court, in a tricorne hat and an ermine collar. He regards the line of assembled supplicants with a dowager aunt’s indignity and an expression of sentimental piety—the recently bankrupt man who gambled with his daughter’s life and, thanks to you, won."
Little Man	http://www.newyorker.com/magazine/2015/08/10/little-man			“My father would live in the castle. The King’s physicians would attend to him. He’s ill—grain dust gets into your lungs.”
Little Man	http://www.newyorker.com/magazine/2015/08/10/little-man			"She says, “This was my mother’s.”"
Little Man	http://www.newyorker.com/magazine/2015/08/10/little-man			"This time, when you’ve finished, she gives you a ring. It, too, is cheap—silver, with a speck of diamond sunk into it."
Little Man	http://www.newyorker.com/magazine/2015/08/10/little-man			"You’ve said it, though. You may as well forge on."
Little Man	http://www.newyorker.com/magazine/2015/08/10/little-man			"It’s one thing to envy wealth and beauty and other gifts that seem to have been granted to others, but not to you, by obscure but undeniable givers. It’s another thing entirely to yearn for what’s so readily available to any drunk and barmaid who link up for three minutes in a dark corner of any dank and scrofulous pub."
Little Man	http://www.newyorker.com/magazine/2015/08/10/little-man			The Queen keeps her face averted. The King emits a peal of laughter that sounds like defeat itself.
Little Man	http://www.newyorker.com/magazine/2015/08/10/little-man			Here’s where you come in.
Little Man	http://www.newyorker.com/magazine/2015/08/10/little-man			"She says, “Please reconsider.”"
Little Man	http://www.newyorker.com/magazine/2015/08/10/little-man			The miller must have felt driven to it. He must have thought he needed a claim that outrageous to attract the attention of the King.
Little Man	http://www.newyorker.com/magazine/2015/08/10/little-man			“Is it Leofrick?”
Little Man	http://www.newyorker.com/magazine/2015/08/10/little-man			You tell her you’re there to help. She nods her thanks. You get to work.
Little Man	http://www.newyorker.com/magazine/2015/08/10/little-man			"You say, “You aren’t going to marry him, are you?”"
Little Man	http://www.newyorker.com/magazine/2015/08/10/little-man			"And, eventually . . . yes. The first few stalks are only touched with gold, like eroded relics, but the next are more gold than straw, and, soon enough, the wheel is spitting out strand upon strand of pure golden straw, not the hard yellow of some gold but a yellow suffused with pink, ever so slightly incandescent in the torch-lit room."
Little Man	http://www.newyorker.com/magazine/2015/08/10/little-man			"There are two of you now. Neither is sufficient unto himself, but you learn, over time, to join your two halves together and hobble around. There are limits to what you can do, though you’re able to get from place to place. Each half, naturally, requires the coöperation of the other, and you find yourself getting snappish with yourself; you find yourself cursing yourself for your clumsiness, your overeagerness, your lack of consideration for your other half. You feel it doubly. Still, you go on. Still, you step in tandem, make your careful way up and down the stairs, admonishing, warning, each of you urging the other to slow down, or speed up, or wait a second. What else can you do? Each would be helpless without the other. Each would be stranded, laid flat, abandoned, bereft. ?"
Little Man	http://www.newyorker.com/magazine/2015/08/10/little-man			Imagine reaching the point at which you want a child more than you can remember ever wanting anything else.
Little Man	http://www.newyorker.com/magazine/2015/08/10/little-man			"But then, on the night of the second day, you make your fatal mistake."
Little Man	http://www.newyorker.com/magazine/2015/08/10/little-man			"The King grins a conquering, predatory grin. The Queen turns away."
Little Man	http://www.newyorker.com/magazine/2015/08/10/little-man			What? Wait a minute . . . .
Little Man	http://www.newyorker.com/magazine/2015/08/10/little-man			"You waver. You’re assaulted by conflicting emotions. You understand the position she’s in. You care for her. You’re in love with her. It’s probably the hopeless ferocity of your love that impels you to stand firm, to refuse her refusal—she who has, on the one hand, succeeded spectacularly and, on the other, consented to what must be, at best, a chilly and brutal marriage. You can’t simply relent and walk back out of the room. You can’t bring yourself to be so debased."
Little Man	http://www.newyorker.com/magazine/2015/08/10/little-man			"You’re not about to reconsider. You might have considered reconsidering before you found yourself in the presence of these two, this tyrannical and ignorant monarch and the girl who agreed to marry him."
Little Man	http://www.newyorker.com/magazine/2015/08/10/little-man			"A year later, when the little boy is born, you go to the palace."
Little Man	http://www.newyorker.com/magazine/2015/08/10/little-man			"You could take it back. You could tell her that you were kidding, that you’d never take a woman’s child."
Little Man	http://www.newyorker.com/magazine/2015/08/10/little-man			“And yet. You can’t marry a monster.”
Little Man	http://www.newyorker.com/magazine/2015/08/10/little-man			"She says, “My father gave me these for my eighteenth birthday.”"
Little Man	http://www.newyorker.com/magazine/2015/08/10/little-man			"And she looks like a queen. Her glowy pallor, her dark intelligent eyes, are every bit as royal-looking as they need to be."
Little Man	http://www.newyorker.com/magazine/2015/08/10/little-man			Welcome to the darker side of love.
Little Man	http://www.newyorker.com/magazine/2015/08/10/little-man			"You’ve thought of letting it pass—of course you have—but, after those months of sleepless musing over the life ahead, your return to the solitude and hopelessness in which you’ve lived for the past year (while people have tried to sell you key chains and medallions with the girl’s face on them, assuming, as well they might, that you’re just another customer, you, who wear the string of garnets under your shirt, the silver ring on your finger) . . . you can’t let it pass."
Little Man	http://www.newyorker.com/magazine/2015/08/10/little-man			"When your turn arrives, you bow to Queen and King. The King nods his traditional, absent-minded acknowledgment. His head might have been carved from marble. His eyes are ice blue under the rim of his gem-encrusted crown. He might already be, in life, the stone likeness of himself that will top his sarcophagus."
Little Man	http://www.newyorker.com/magazine/2015/08/10/little-man			"You wish you could feel more purely angry about that possibility. You wish you didn’t sympathize, not even a little, with her in the predicament she’s created for herself."
Little Man	http://www.newyorker.com/magazine/2015/08/10/little-man			"You return to the castle the next day, and the next. The King scowls murderously (what story has he been told?) as the Queen runs through a gamut of guesses."
Little Man	http://www.newyorker.com/magazine/2015/08/10/little-man			"She slips it onto your pinkie. It fits, just barely. You stand for a moment staring at your hand, which is not by any standards a pretty sight, with its knobbed knuckles and thick, yellowed nails. But here it is, your hand, with her ring on one of its fingers."
Little Man	http://www.newyorker.com/magazine/2015/08/10/little-man			"She says, “Is it Brom?”"
Little Man	http://www.newyorker.com/magazine/2015/08/10/little-man			"With that, you’re gone."
Little Man	http://www.newyorker.com/magazine/2015/08/10/little-man			"The King looks disapprovingly at his wife. His face bears no hint of a question. He skips over the possibility of innocence. He wonders only what, exactly, it is that she has done."
Little Man	http://www.newyorker.com/magazine/2015/08/10/little-man			"“That’s not magic,” she says, laughing."
