    				
    				
    				
    				
"    If you're already a subscriber please sign in or link your subscription."""				
"    If you're already a subscriber please sign in or link your subscription."""				
"    If you're already a subscriber please sign in or link your subscription."""				
"    If you're already a subscriber please sign in or link your subscription."""				
Chicken Hill	http://www.newyorker.com/magazine/2015/09/14/chicken-hill			
Chicken Hill	http://www.newyorker.com/magazine/2015/09/14/chicken-hill			"You've read your last complimentary article this month. To read the full article, SUBSCRIBE NOW"
Chicken Hill	http://www.newyorker.com/magazine/2015/09/14/chicken-hill			"She didn’t know what had possessed her to participate in such a thing. A little boy had been run over by a sheriff’s deputy, and there was a memorial fund-raiser at the Barbed Wire, a biker bar in a somewhat alarming part of town, and Ruth had gone and bought a beer and put thirty dollars into an empty terrarium, for funeral expenses. The place was loud and crowded, and she was given a plate with a tamale on it. Outside, someone had brought a pony and was providing pony rides for the dead boy’s friends. No one spoke to her directly, but she learned that the boy’s name was Hector and that his father was suing the sheriff’s department."
Five Arrows	http://www.newyorker.com/magazine/2015/08/03/five-arrows			"“Yes, Big Uncle, I swear.” I was suddenly afraid, but then he gave me a wide smile and sat down again in a single motion, tired and old."
Five Arrows	http://www.newyorker.com/magazine/2015/08/03/five-arrows			"We shook our heads no, though we both did."
Five Arrows	http://www.newyorker.com/magazine/2015/08/03/five-arrows			"“Yes, sir.”"
Five Arrows	http://www.newyorker.com/magazine/2015/08/03/five-arrows			"“Our ancestors were fierce archers,” Big Uncle said. “I don’t know where we learned it. From the Mongols, probably. In the old days, there were men in the Lee clan who galloped on horseback and shot arrows so straight they could hit the hole in a dangling coin.”"
Five Arrows	http://www.newyorker.com/magazine/2015/08/03/five-arrows			"We dragged the boat up a little ways, and I uncoiled the rope and tied it to a sapling."
Five Arrows	http://www.newyorker.com/magazine/2015/08/03/five-arrows			"We didn’t know what to say, because any answer would have been wrong. If we said yes, we’d be admitting that we had smelled his rotting flesh before the cigarette smoke, and if we said no we’d be saying that the smell of smoke didn’t cover the odor of his foot, which he had wrapped in a makeshift bandage of dry moss, with only a few strands of straw to bind it together."
Five Arrows	http://www.newyorker.com/magazine/2015/08/03/five-arrows			"“Ya! ” Yongsu called after me. “Careful!” I heard his footfalls catching up to me as I ran along the trail through patches of light and shadow, feeling the texture of the ground change under me as I trod on pine needles, then pebbles, then dry earth."
Five Arrows	http://www.newyorker.com/magazine/2015/08/03/five-arrows			"“An inauspicious number,” Big Uncle said. “Sa. The death number. The snake number. You know, ungh?”"
Five Arrows	http://www.newyorker.com/magazine/2015/08/03/five-arrows			“Stop!” the shape said.
Five Arrows	http://www.newyorker.com/magazine/2015/08/03/five-arrows			“That’s right.”
Five Arrows	http://www.newyorker.com/magazine/2015/08/03/five-arrows			"In a few moments, Yongsu was at my side, tugging at my shirt to make me stop, but I pulled away and continued to run in the direction of the sound. We came around a sharp bend in the trail and squinted into the sun that shone through a gap in the trees. A huge silhouette stood before us, massive and black to our sun-blind eyes."
Five Arrows	http://www.newyorker.com/magazine/2015/08/03/five-arrows			"“Now, why do you suppose this was? Why would I remember this part of the night years and years later? That woman was like a Heavenly Maiden, but I know she was the ghost of a virgin who had died a very long time ago. Probably when the Chinese or the Mongols were in our country. She must have been a princess, with all that jewelry and those servants. She must have been waiting for centuries for some man to come along and release her into the next world with the power of his yang."
Five Arrows	http://www.newyorker.com/magazine/2015/08/03/five-arrows			"“When I woke up, it was past dawn. The sun was above the horizon, and a streak of light was shining on my face. I sat there for the longest time, because I thought the ghost had tied me up to that tree, but then, when I finally had the strength and the courage to look around, I saw that I was sitting against the tree as if I were tied to it, but there were only a few dried-up strands of grass around me. Not even enough to weave into a bad straw rope."
Five Arrows	http://www.newyorker.com/magazine/2015/08/03/five-arrows			“Do you swear?”
Five Arrows	http://www.newyorker.com/magazine/2015/08/03/five-arrows			“We have to find the arrows. What else can we do?”
Five Arrows	http://www.newyorker.com/magazine/2015/08/03/five-arrows			“Ah.” He moved the half-smoked Camel to the other side of his mouth.
Five Arrows	http://www.newyorker.com/magazine/2015/08/03/five-arrows			“Yongsu won’t be there with the boat. You’re going to have to swim across. Can you do that?”
Five Arrows	http://www.newyorker.com/magazine/2015/08/03/five-arrows			"I sat at the edge of the fire and took the spitted bird from Big Uncle. I realized that he had cooked only two birds, and I looked from mine to his."
Five Arrows	http://www.newyorker.com/magazine/2015/08/03/five-arrows			“The smell bother you?”
Five Arrows	http://www.newyorker.com/magazine/2015/08/03/five-arrows			"“It’s been a long time, ungh? Pull that arrow out and follow me. Have you brought me anything to eat?”"
Five Arrows	http://www.newyorker.com/magazine/2015/08/03/five-arrows			"Big Uncle hobbled back up the trail, and Yongsu followed, leaving me with the arrow. The tip had punctured the bark of the tree and buried itself so far in the trunk that I had to grasp the arrow shaft with both hands—as close to the tip as possible for fear of breaking it—and move it gingerly back and forth until it dislodged. By the time I had it out, intact, Yongsu and Big Uncle were out of sight, and I had to run as quickly as I could to find them."
Five Arrows	http://www.newyorker.com/magazine/2015/08/03/five-arrows			"“Like our Hong Gil-dong, ungh?”"
Five Arrows	http://www.newyorker.com/magazine/2015/08/03/five-arrows			"As I tightened my abdominal muscles and pressed my palms together to get my blood flowing, I noticed a small sooty teapot quietly steaming over the fire."
Five Arrows	http://www.newyorker.com/magazine/2015/08/03/five-arrows			"“And there were two little scars on my foot. It didn’t look much worse than a couple of mosquito bites or maybe a couple of pimples, but that’s what festered later and spread up and down my foot. Even with the best Chinese medicine, it never really healed. Everyone says it was a snakebite, but that’s not true."
Five Arrows	http://www.newyorker.com/magazine/2015/08/03/five-arrows			"“Yes, I slept. I’m half asleep all the time, so the night doesn’t make much difference. Any dreams?”"
Five Arrows	http://www.newyorker.com/magazine/2015/08/03/five-arrows			"“I shouldn’t have left the trail. That was a mistake. Before I knew it, I was in the middle of the woods, and the light, which had been right in front of me, suddenly blinked out, and I was in the pitch-black night. I couldn’t see anything. I was reaching out around myself so the tree branches wouldn’t scratch out my eyes."
Five Arrows	http://www.newyorker.com/magazine/2015/08/03/five-arrows			"“I was thinking about your bow, Big Uncle.”"
Five Arrows	http://www.newyorker.com/magazine/2015/08/03/five-arrows			“You’re going?” I said.
Five Arrows	http://www.newyorker.com/magazine/2015/08/03/five-arrows			"“Look,” I said to Yongsu. There were rags draped over the lower branches of a tree to dry in the sun, and they were still discolored—yellow and red—with what must have been the pus and blood oozing from Big Uncle’s sores."
Five Arrows	http://www.newyorker.com/magazine/2015/08/03/five-arrows			"“Sometimes, when I get a little drunk, I can remember even more about how beautiful everything was, but then, when I’m sober again, I forget. But it was beautiful. She was the most beautiful woman I’ve ever seen, and coupling with her was wonderful. I think I can remember, sometimes, that we rutted like animals without all those servants around."
Five Arrows	http://www.newyorker.com/magazine/2015/08/03/five-arrows			"“Hello, Big Uncle,” I said."
Five Arrows	http://www.newyorker.com/magazine/2015/08/03/five-arrows			“Do you think we’ll be able to find Big Uncle?” I asked.
Five Arrows	http://www.newyorker.com/magazine/2015/08/03/five-arrows			"“It wasn’t until years later that I remembered what happened to me after I was blinded by that light. And it was in a dream. I remembered it in a dream. A beautiful woman came out of that light. She was dressed in a white costume in the Chinese style. The fabric was like the finest silk, so white it was like silver. She had long black hair and very big eyes—round eyes, almost Western. She told me to come with her, and I understood her though she didn’t seem to speak. I went into that light, and then I found myself on a high Chinese-style bed with no bed mat under me. The woman’s servants were standing around me, looking down at me. There were shiny silver ornaments and decorations everywhere. Beautiful things that looked like jewelry and weapons and eating utensils. The lamp they shined down on me was brighter than the sun. White light was floating everywhere like flour dust, and the beautiful woman climbed up on the bed, on top of me, and, right in front of her servants, she took off her clothes and pushed herself down onto me. I thought my penis would burst, but she was slightly cold, not like a Korean woman. It was almost impossible to feel anything with all those servants watching me, but somehow I managed to squirt my seed into her, and then everything grew dark again."
Five Arrows	http://www.newyorker.com/magazine/2015/08/03/five-arrows			"Yongsu started up the trail, but I ran ahead of him, shouting “Big Uncle! Big Uncle!” until I thought I heard him reply."
Five Arrows	http://www.newyorker.com/magazine/2015/08/03/five-arrows			"“I don’t know much about those Taoist things,” I said."
Five Arrows	http://www.newyorker.com/magazine/2015/08/03/five-arrows			"“No, Big Uncle.”"
Five Arrows	http://www.newyorker.com/magazine/2015/08/03/five-arrows			“What’s the matter? I gave you the small one?”
Five Arrows	http://www.newyorker.com/magazine/2015/08/03/five-arrows			"“It was a wooden bow, Big Uncle. They called them longbows, and they could shoot arrows that could pierce armor.”"
Five Arrows	http://www.newyorker.com/magazine/2015/08/03/five-arrows			"I looked out across the flat expanse of the river-become-a-lake, recalling the last time I had been here—the gentle sound of the current, the clear water more transparent than air, flowing icy cold under the boat, and the pebbles, white and gray and black, slick and wet, so distant and yet so close, as the shadow of the boat slipped above them, rippling the bright-blue reflection of the sky. Even the air was clearer back then, without this invisible mist which seemed almost a mental pollution. How could they give up the old river for this murky green plane on which even the reflections looked stagnant? All the old channels must have been clogged with algae and the sort of scum that collects on a dead pond. You could smell the faint rot as the oars disturbed the surface. The creak and the rhythm made me think of voices—and I could almost hear them, nearly as loud as the gurgling sound of the oars dipping into the water—until Yongsu stopped rowing and we butted against the shore."
Five Arrows	http://www.newyorker.com/magazine/2015/08/03/five-arrows			"That was five years ago. The water was so clear back then that it seemed only a few palm widths deep, shallow enough for me to reach down and touch the pebbles that rippled in the play of light and the shadow of the boat. Now, when I looked over the side, the water was a foggy green color, and after the first few feet I couldn’t see the bottom. “What happened to the water?” I said. “There’s something green in it.”"
Five Arrows	http://www.newyorker.com/magazine/2015/08/03/five-arrows			"I ate, too, and despite my queasiness at the clump of black crow feathers I saw in the underbrush, the meat tasted wonderful, its gamy tang cut by the salt. My face warmed by the fire, and my stomach rumbling even as I ate, I tore my bird to shreds and sucked at the bones until they were dry. It was dark when we were done, and we passed the jug of water back and forth to wash down the last scraps of crow meat."
Five Arrows	http://www.newyorker.com/magazine/2015/08/03/five-arrows			"Yongsu and I launched the flat-bottomed boat from a muddy part of the river I didn’t recognize. It seemed the bank of the river had moved much closer to the village, though I knew it hadn’t rained much that year. We took our places and, as Yongsu pulled the oars, I scanned the far shore for a good place to land—a landmark that Yongsu could aim for to counter the current."
Five Arrows	http://www.newyorker.com/magazine/2015/08/03/five-arrows			"“Well, it’s a story. Like some folktale. But everyone’s life is like a story, isn’t it? From a long, long time ago.”"
Five Arrows	http://www.newyorker.com/magazine/2015/08/03/five-arrows			"“We used to call this place Skullhead Cave,” Big Uncle said, “because it looks like the top of a skull, and the two openings are like half-buried eye sockets. But now no one even knows what it’s called anymore. And why do you suppose I live in this cave?” He stared at us for a moment. “Don’t you think I’d live in a house if I could?”"
Five Arrows	http://www.newyorker.com/magazine/2015/08/03/five-arrows			"“I’ll come back in the morning. You’re going to be out here all night looking for arrows in the trees, stupid.”"
Five Arrows	http://www.newyorker.com/magazine/2015/08/03/five-arrows			"“Now, that’s a good story,” Big Uncle said after a moment. “This Ro Bing Ho sounds like a good man. Did he come from a family of warriors or farmers?”"
Five Arrows	http://www.newyorker.com/magazine/2015/08/03/five-arrows			"“Well, since you plucked that other arrow this morning, let’s say you found five. Now, five is an interesting number. O. It sounds like the sign of the horse, or a mistake, or a word for anguish. O-da. You have come. O-do. You have awakened.” He ran each arrow through his fingers, checking to see if their shafts had split, if their feathers had come undone. “So what do you think, Insu-ya?”"
Five Arrows	http://www.newyorker.com/magazine/2015/08/03/five-arrows			"“Then the light blinked on again somewhere to my right. Then off again, and it reappeared somewhere to my left. And that’s when I knew it was a goblin light or a ghost. I started thinking of all those terrible stories about the woodcutters who see the lights at night and then get enticed by fox demons and have their life energy sucked out. I started running back toward the trail, or where I thought it should be, but the light kept appearing in front of me, and then I would change directions and run headlong into a tree or fall into a hole."
Five Arrows	http://www.newyorker.com/magazine/2015/08/03/five-arrows			"I searched for Big Uncle’s arrows until the light waned and I could no longer discern the colors in the shadows. I was terribly frustrated at first, impatient and even angry as I waded through patches of high grass, cutting my flesh, or picked my way through tangles of shrubbery because I thought I had glimpsed a yellow feather on the other side. At one point, the heat of the day seeping into my sweaty body, I rested under a tree, half dozing in its cool shade and the breeze that came across the flat green river. In a momentary lapse into real sleep, I had the briefest of dreams: I was sitting with my back against a tree, but it was nighttime, and it was raining so hard that not even the branches could protect me; water sluiced down on me each time the wind shifted, and I tried to huddle into myself, chilled like the blade of a knife that could cut me to the bone. I was going to die, and the fear and the cold woke me up into the slightly thick and groggy heat of late afternoon. It must have been the heat, I thought. I dreamed of the opposite thing even though in my dream I’d been doing the same thing—looking for Big Uncle’s arrows. I resumed my search and, while the light held, I happened on a place where Big Uncle’s aim must have been especially bad. I found four arrows."
Five Arrows	http://www.newyorker.com/magazine/2015/08/03/five-arrows			"We didn’t know what to say to Big Uncle. We had never heard him so bitter before, so crude and angry."
Five Arrows	http://www.newyorker.com/magazine/2015/08/03/five-arrows			"“No, Big Uncle.”"
Five Arrows	http://www.newyorker.com/magazine/2015/08/03/five-arrows			"“No, sir. I was just wondering—”"
Five Arrows	http://www.newyorker.com/magazine/2015/08/03/five-arrows			"“Ah, fuck it! We shouldn’t have let him talk to us like that. I’m not staying out here in the woods to fetch some damned arrows for the old man.” He shoved the water jug into my belly and stalked off down the trail to the river."
Five Arrows	http://www.newyorker.com/magazine/2015/08/03/five-arrows			"“Yes, Big Uncle!” we called back."
Five Arrows	http://www.newyorker.com/magazine/2015/08/03/five-arrows			"“Now, Little Uncle didn’t tell you that part of the story, did he?”"
Five Arrows	http://www.newyorker.com/magazine/2015/08/03/five-arrows			"“Insu-ya,” he said."
Five Arrows	http://www.newyorker.com/magazine/2015/08/03/five-arrows			"“Yes, Big Uncle.”"
Five Arrows	http://www.newyorker.com/magazine/2015/08/03/five-arrows			"“What do you think of me saving them the trouble, ungh? They won’t even have to roll the rock back for me, since I’m living in my own cave shack. But maybe the animals will get in and eat my shrivelled corpse before they get me. Wouldn’t that be a shame?”"
Five Arrows	http://www.newyorker.com/magazine/2015/08/03/five-arrows			"“Let’s have some cha before you go,” Big Uncle said without looking at me. “I would offer you coffee, which is what Yankees do, I suppose, but I’m fresh out.”"
Five Arrows	http://www.newyorker.com/magazine/2015/08/03/five-arrows			"My nose was beginning to fill, and the pressure in my head told me that I should kick up. For some reason, I felt I had been there before—right there—or would be again. Suddenly I wanted to look around to see if I could see myself looking at me, but the feeling that gave me was so strange that I shook my head, releasing bubbles that showed me which way was up. I slowly raised my sluggish arms, moving them up against the unexpectedly fierce resistance of the water, and then arced them back down again as I gave a violent scissor kick. Green light. Green shadow. Intermediate greens in infinite gradations, subtle and distinct, as numerous as all the names of God. Upward, at the surface, a dark, irregular silhouette with a sharp tail protruding, like the tail of an angular manta ray—it was my raft of clothes, and as I raced my own rising bubbles toward it I thought I glimpsed, just for a second, out of the corner of my eye, a giant green carp beneath me, flicking its broad tail in the very periphery of my vision. ?"
Five Arrows	http://www.newyorker.com/magazine/2015/08/03/five-arrows			"It was bitter and soothing, and the steam warmed my face. I sipped a little at a time, holding the can between my palms when it had cooled enough not to burn me. “Why do you say dreams are our real life?”"
Five Arrows	http://www.newyorker.com/magazine/2015/08/03/five-arrows			“How will I get across the river if you take the boat?”
Five Arrows	http://www.newyorker.com/magazine/2015/08/03/five-arrows			"I added the wood and handed him a long splinter, burning at the end like a match, and he lit one of the Camels I had given him. He seemed ready to withdraw; I could see him sitting there, gazing into the fire and thinking his thoughts as if I were not even there, breathing deeply through his nose, exhaling long plumes of smoke, black eyes glinting in the red-and-yellow firelight. Had I not been there, perhaps he would have spoken to himself or sat in some kind of trance, talking with his spirits and his dreams. Had I not been there, he might have sung himself to sleep with the songs from his childhood, the ones his mother and his aunts sang for him on warm summer nights. Had I not been there, he might have wept with sadness or shouted out his anger at the family that had driven him across the river to live like a Taoist hermit, and in the momentary quiet of his cigarette smoking I wished I weren’t there in body but looking down on Big Uncle instead, watching over him from above, the way his tutelary spirit might from the other world."
Five Arrows	http://www.newyorker.com/magazine/2015/08/03/five-arrows			"“If both of you had come back? Well, then, I suppose you’d be fighting over the one, ungh?” He laughed and tore a piece of meat from the breast of his to dab in the salt."
Five Arrows	http://www.newyorker.com/magazine/2015/08/03/five-arrows			"“We all know.” Big Uncle lit a cigarette and sucked on it with the same motion he used to sip his can of tea. “Now go, because you’re going to be hungry, and I have nothing to feed you. When you come back to see me again, bring me some coffee and something good to eat.”"
Five Arrows	http://www.newyorker.com/magazine/2015/08/03/five-arrows			"“Say what’s on your mind now,” Big Uncle said. “At times like this, you should let the thoughts leap off your tongue. You don’t want to be regretful.”"
Five Arrows	http://www.newyorker.com/magazine/2015/08/03/five-arrows			"“Aigo, you unmannered fools.”"
Five Arrows	http://www.newyorker.com/magazine/2015/08/03/five-arrows			“Quiet!” Yongsu said. “I hear footsteps. It’s someone limping.”
Five Arrows	http://www.newyorker.com/magazine/2015/08/03/five-arrows			“I don’t remember.”
Five Arrows	http://www.newyorker.com/magazine/2015/08/03/five-arrows			"“What’s good, Big Uncle?”"
Five Arrows	http://www.newyorker.com/magazine/2015/08/03/five-arrows			"When we were out of earshot, Yongsu smacked me on the shoulder and said, “Now what are we going to do, ungh?”"
Five Arrows	http://www.newyorker.com/magazine/2015/08/03/five-arrows			"“Ya, it feels like I’ll live awhile now,” Big Uncle said, slipping the extra cigarette back into the pack and then putting the pack into his vest pocket almost unconsciously. He lit the cigarette and took a deep first drag, savoring the smoke in his lungs before blowing it in a long plume at his gangrenous foot. “Helps cover the smell, ungh?”"
Five Arrows	http://www.newyorker.com/magazine/2015/08/03/five-arrows			"“Listen,” Big Uncle said. “You two go out into the woods and fetch me five of my arrows, and I’ll tell you the story. It’s going to take you a while, so I’ll have something good to eat waiting for you when you get back. Understood?”"
Five Arrows	http://www.newyorker.com/magazine/2015/08/03/five-arrows			“Where did you get it? Where did you learn how to shoot it?”
Five Arrows	http://www.newyorker.com/magazine/2015/08/03/five-arrows			"“I did my best,” I said. “I’m sorry I only found four arrows.”"
Five Arrows	http://www.newyorker.com/magazine/2015/08/03/five-arrows			"“I was wondering about your foot,” I said."
Five Arrows	http://www.newyorker.com/magazine/2015/08/03/five-arrows			"I stopped there and watched Yongsu disappear as the trail descended sharply and veered to the right. In a few moments, I could no longer hear the heavy crunch of his footfalls, and the woods grew so quiet I thought I could make out the sound of blood rushing in my head."
Five Arrows	http://www.newyorker.com/magazine/2015/08/03/five-arrows			"We had come up from Bupyeong on a lark. Yongsu had got into some trouble and needed to avoid his dropout friends. I’d recently moved back to Korea after two years away in America and Germany, where my father’s duty stations had taken him. I’d begun skipping school, and since I hadn’t missed any classes yet that week, I had decided to play hooky for a couple of days. Neither of us had been out in the country in a long time, so we had come to pay a visit to Little Uncle and Big Uncle, who liked us and wouldn’t mind keeping a secret. But when we’d arrived in Sambong-ni, the previous night, we’d learned that the gangrene in Big Uncle’s old foot injury had come back. This time the stench was so bad that the family had sent him across the river to the old cave. Little Uncle told us that we had to go and see him, because everyone was worried that Big Uncle might die this time."
Five Arrows	http://www.newyorker.com/magazine/2015/08/03/five-arrows			"“No, sir,” Yongsu said as I struggled to pull the arrow out."
