    				
Little Man	http://www.newyorker.com/magazine/2015/08/10/little-man			"As you stand in line, you see that the Queen has noticed you."
Little Man	http://www.newyorker.com/magazine/2015/08/10/little-man			"The Queen sends messengers out all over the kingdom, in an attempt to track down your name. You know how futile that is. You live in a cottage carved into a tree, so deep in the woods that no hiker or wanderer has ever passed by. You have no friends, and your relatives live not only far away but in residences at least as obscure as your own (consider Aunt Farfalee’s tiny grotto, reachable only by swimming fifty feet under water). You’re not registered anywhere. You’ve never signed anything."
Little Man	http://www.newyorker.com/magazine/2015/08/10/little-man			"You suppose (as an aspiring parent yourself, you prefer to think of other parents as un-deranged) he is hoping that if he can get his daughter into the palace, if he can figure out a way for her to meet the King, for the King to see the pale grace of the girl’s neck and her shy smile, and hear the sweet clarinet tone of her soft but surprisingly sonorous voice, the King will be so smitten (doesn’t every father believe his daughter to be irresistible?) that he’ll forget about the absurd straw-into-gold story."
Little Man	http://www.newyorker.com/magazine/2015/08/10/little-man			“My father could live in the palace with me.”
Little Man	http://www.newyorker.com/magazine/2015/08/10/little-man			"He’s joking, right?"
Little Man	http://www.newyorker.com/magazine/2015/08/10/little-man			"No one in the family, not in the past few centuries, at any rate, has thought of making a living at it. It’s not . . . respectable. It smells of desperation. And—as is the way with spells and conjurings—it’s not a hundred per cent reliable. It’s an art, not a science. Who wants to refund a farmer’s money as he stands destitute in his still parched fields? Who wants to say, “I’m sorry, it works most of the time,” to the elderly couple who still hear cackles of laughter coming from under their mattress, whose cutlery still jumps up from the dinner table and flies around the room?"
Little Man	http://www.newyorker.com/magazine/2015/08/10/little-man			"You listen carefully, then, when you hear the rumor. Some impoverished miller—a man whose business is going under (the small-mill owners, the ones who grind by hand, are vanishing; their flour and meal cost twice as much as the big-brand products, which are free of the gritty bits that can find their way into a sack of flour no matter how careful you are), a man who has no health insurance or investments or pension plan (he’s needed every cent just to keep the mill open)—that man has told the King that his daughter can spin straw into gold."
Little Man	http://www.newyorker.com/magazine/2015/08/10/little-man			"You return, triumphant, to the castle on the third and final afternoon. You are for the first time in your life a figure of power, of threat. Finally, you cannot be ignored or dismissed."
Little Man	http://www.newyorker.com/magazine/2015/08/10/little-man			"It’s surprising, then, that on this final night you don’t want to leave unrewarded. That you desire, with upsetting urgency, another token, a talisman, a further piece of evidence. Maybe it’s because you know you won’t see her again."
Little Man	http://www.newyorker.com/magazine/2015/08/10/little-man			"But still she takes a strand of beads from her neck and holds them out to you. They’re garnets, cheap, probably dyed, though in this room, at this moment, with all that golden straw emanating its faint light, they’re as potently red-black as heart’s blood."
Little Man	http://www.newyorker.com/magazine/2015/08/10/little-man			"You’re as surprised as she is when you hear yourself say, “Promise me your firstborn child, then.”"
Little Man	http://www.newyorker.com/magazine/2015/08/10/little-man			That’s the reward? Marriage to a man who’d have had you decapitated if you failed to produce not just one but three miracles?
Little Man	http://www.newyorker.com/magazine/2015/08/10/little-man			No.
Little Man	http://www.newyorker.com/magazine/2015/08/10/little-man			"You’ll ask yourself, afterward, Why did I build a fire in front of the cottage tree and do that little song and dance? It seems harmless at the time, and you are so happy, so sure. You find yourself sitting alone in your parlor, thinking of where the cradle should go, wondering who’ll teach you how to fold a diaper, picturing the child’s face as he looks up at you and says, “Father.”"
My Curls Have Blown All the Way to China	http://www.newyorker.com/magazine/2015/09/21/my-curls-have-blown-all-the-way-to-china			"You've read your last complimentary article this month. To read the full article, SUBSCRIBE NOW"
My Curls Have Blown All the Way to China	http://www.newyorker.com/magazine/2015/09/21/my-curls-have-blown-all-the-way-to-china			
My Curls Have Blown All the Way to China	http://www.newyorker.com/magazine/2015/09/21/my-curls-have-blown-all-the-way-to-china			I took a piece of paper from Moshe’s messy desk and made a list of winter clothes to buy:
Silk Brocade	http://www.newyorker.com/magazine/2015/07/27/silk-brocade			"Sally had always known that the white brocade had belonged to a lady who died before her wedding. The man she was meant to marry had owned a stately home with a deer park, and the twist in the story was that she’d been a nurse, had saved his life when he was ill. Ann and Kit Seaton—who was Sally’s godmother—had picnicked with them once in the deer park. Then the nurse had caught diphtheria from one of her patients and was dead within a week. Her fiancé had written to them, returning their designs and saying that he would not need their services after all, “for the saddest of reasons.” They hadn’t known what to do with the fabric, Ann said. They couldn’t just post it to him. They hadn’t even sent a note—they couldn’t think what words to use; they were too young. Ann hadn’t kept his letter or her designs; she regretted now that she’d hardly kept anything when she got married and she and Kit gave up the business. There were only a few woven Gallagher and Seaton labels, tangled in a snarled mass of thread and bias binding and rickrack braid in her workbasket. She and Kit had never even thought to take photographs of the clothes they’d made."
Silk Brocade	http://www.newyorker.com/magazine/2015/07/27/silk-brocade			"Ann put on the percolator in the kitchenette. Kit had grown up in France, or claimed she had, and insisted that they always make real coffee. They served it in little turquoise coffee cups, with bitter-almond biscuits, on a Japanese lacquer tray that Ann had found in a junk shop. Sometimes the coffee was so strong the clients could hardly swallow it."
Silk Brocade	http://www.newyorker.com/magazine/2015/07/27/silk-brocade			"“Come on, Annie-Pannie. You think it’s pretty extraordinary, too, I know you do. Don’t be chippy, don’t get on your old socialist high horse, just because you’ve got a pash on Mr. Misery-Guts Donny Ross.”"
Silk Brocade	http://www.newyorker.com/magazine/2015/07/27/silk-brocade			“What do you know about Fishponds?” Ann said sharply.
Silk Brocade	http://www.newyorker.com/magazine/2015/07/27/silk-brocade			"“Oh, that won’t be a problem,” Nola began to say. “Because the man I’m marrying, my fiancé . . .”"
Silk Brocade	http://www.newyorker.com/magazine/2015/07/27/silk-brocade			"She showed Nola into the fitting room. They had a sewing room and a fitting room and a little windowless kitchenette and a lavatory; a dentist on the ground floor used the front basement rooms for storage, and they sometimes heard his heavy footsteps on the stairs. The Third Programme helped drown out the sound of his drill when clients came for fittings. Ann and Kit had made gold velvet curtains for the fitting-room windows and covered a chaise longue in matching velvet; on the white walls there were prints of paintings by Klee and Utrillo and a gilt antique mirror with a plant trailing round it. Morning light waited, importantly empty, in the cheval glass. Kit sometimes brought her boyfriends to this room at night, and Ann had to be on the lookout for the telltale signs—dirty ashtrays, wineglasses, crumpled cushions. She was convinced that Kit had actually been making love once on top of someone’s evening dress, laid out on the chaise longue after a fitting."
Silk Brocade	http://www.newyorker.com/magazine/2015/07/27/silk-brocade			"The surprise was that Blaise turned out to be as much of a socialist as Donny Ross, even if he did own a deer park. He didn’t object to any of the taxes, he said. The only damn problem was finding enough money to pay them, because old houses these days didn’t come with money attached. Thwaite was a bottomless pit when it came to money. He ought to give the place up, sell it as a hotel or something, but he was too sentimental. Anyway, there were an awful lot of big old houses on the market, and it wasn’t a good time in the hotel business. He and Nola called each other “Dear” and passed each other salt, in a twist of greaseproof paper, to go with the eggs. Kit had made little crustless sandwiches with cucumber and foie gras from a tin, and pinched bottles of champagne from her father’s wine cellar. She still lived at home in the suburbs with her widowed daddy, retired from his insurance job, whom she adored—though Ann thought he was a horrible old man. He’d told her once that little tarts ought to be flogged, to teach them a lesson."
Silk Brocade	http://www.newyorker.com/magazine/2015/07/27/silk-brocade			"Ann Gallagher was listening to the wireless, cutting out a boxy short jacket with three-quarter-length sleeves, in a pale-lilac wool flecked with navy. She had cut the pattern from her own design—there was a matching knee-length pencil skirt—then pinned the paper shapes onto the length of cloth, arranging and rearranging them like pieces of a puzzle to make them fit with minimum waste. Now her scissors bit in with finality, growling against the wood surface of the table, the cloth falling cleanly away from the blades. These scissors were sacrosanct and deadly, never to be used on anything that might blunt them. Ann and her friend Kit Seaton were renting the back basement of a big house in a residential area of Bristol for their dressmaking business; because the house was built on a hill, their rooms opened onto a garden, and sunlight fell through the French windows in shifting patches onto Ann’s cutting table."
Silk Brocade	http://www.newyorker.com/magazine/2015/07/27/silk-brocade			"“Well, aren’t you the lucky one,” Ann said admiringly. “A lovely chap, and he can pay as well!”"
Silk Brocade	http://www.newyorker.com/magazine/2015/07/27/silk-brocade			"When Sally Ross was sixteen, in 1972, her mother, Ann, made her a jacket out of an old length of silk brocade, embroidered with flowers. The white brocade had been around since Sally could remember, folded in a cupboard along with all the other pieces of fabric that might be used sometime, for something or other. Now they decided to dye it purple. This was the same summer that Sally’s father, the doctor, had moved out to live with another woman. Ann had sold all his jazz records and chopped his ties into bits with her dressmaking scissors, then burned them in the garden. Of course, Sally and her sisters and brother were on their mother’s side. Still, they were shocked by something so vengeful and flaunting, which they’d never before imagined as part of her character. Her gestures seemed drawn from a different life than the one they’d had so far, in which things had been mostly funny and full of irony."
Silk Brocade	http://www.newyorker.com/magazine/2015/07/27/silk-brocade			"Kit flopped back onto the chaise longue in exaggerated despair, limbs flung out like a doll’s. “When she comes back, you’re to tell her you’ve changed your mind. I’d die for an invitation to go out there and poke around. Imagine what they’ve got in their attic!”"
Silk Brocade	http://www.newyorker.com/magazine/2015/07/27/silk-brocade			"“She knows what she’s doing,” Kit reassured Nola. “She’s a genius.”"
Silk Brocade	http://www.newyorker.com/magazine/2015/07/27/silk-brocade			"“These do look beautiful,” Nola conceded yearningly."
Silk Brocade	http://www.newyorker.com/magazine/2015/07/27/silk-brocade			"Later that afternoon, while Kit put on different outfits to entertain Ray—and at some point Ray exhibited himself, too, in a green satin gown, made up with Kit’s lipstick and powder—Donny Ross came prowling around where Ann was cutting out the lining for the suit. “Do you mind?” he said. And he called her an angel-innocent and a clever daft thing, in a comical, mincing, falsetto voice. Ann didn’t usually let people into the sewing room; she was anxious about keeping the fabrics pristine. With his hands in his pockets, frowning, Donny was working through some jazz tune to himself, in a way that you couldn’t really call singing; it was more as if he were imitating all the different instruments in turn, taking his hands out of his pockets to bang out the drum part on the end of her cutting table. Ann might just as well not have been there: he threw his head back and stared up into the corners of the room as if all the evidence of her sewing, spread out around him, were simply too frivolous for him to look at. It was peculiar that she didn’t feel any urge to entertain or charm him, though she knew how charming she could be when she tried. She carried on steadily, concentrating on her work, feeling as if some new excitement were waiting folded up inside her, not even tried on yet."
Silk Brocade	http://www.newyorker.com/magazine/2015/07/27/silk-brocade			"She gave Kit the piece of paper where Nola had written down the details, and expected her to make her usual disdainful face when she read through it, as if something smelled funny. Kit had a long, horsey face, tousled honey-colored hair, and a stubby, sexy, decisive little body, like an overdeveloped child’s; she expressed all her tastes and distastes as if they afflicted her physically, through her senses. To Ann’s surprise, she sat up excitedly. “Oh, Lawd, this is a marvel. I can’t believe you don’t know where this wedding is, you angel-innocent. It’s the most perfect little bijou Queen Anne house, tucked away in its own deer park on the way to Bath. Look what you’ve done, you clever daft thing! The pictures will be in all the good papers.”"
Silk Brocade	http://www.newyorker.com/magazine/2015/07/27/silk-brocade			"She didn’t have the same broad Bristol accent as her parents—Ann’s mother would have said that she was nicely spoken. It was about a wedding dress, of course. The wedding would be in June, Nola said. It would be a quiet one, at least she hoped so. She knew that this was short notice and probably Ann was all booked up, but they had decided in a hurry. “Not that kind of hurry,” she added, laughing without embarrassment. “I suppose you sometimes have to let out the waists as the brides get bigger.”"
Silk Brocade	http://www.newyorker.com/magazine/2015/07/27/silk-brocade			"After the conference lunch, in a lull while the teachers drank coffee outside in the sunshine, Sally wandered upstairs to look around. Although the rooms of the house had been converted into teaching spaces, with bookshelves and blackboards and overhead projectors, you could see that it had been a home once. One of the rooms was papered with Chinese wallpaper, pale blue, patterned with birds and bamboo leaves. In another room, polished wood cupboards were built in from floor to ceiling; these were full of stationery supplies and art materials. Someone from the catering staff had followed Sally upstairs, and she found herself explaining the whole story to him—about her parents separating and the jacket and her mother’s sad association with the house. This wasn’t her boyfriend but another boy who worked with them, better-looking and more dangerous. Sally was trying her power out on him; she shed tears of self-pity, until he put his arms around her and kissed her. And, amid all the complications and adjustments that ensued, she forgot to collect her jacket when they left, though she didn’t confess this to her mother until months later. A jacket hardly mattered, in the scheme of things. ?"
Silk Brocade	http://www.newyorker.com/magazine/2015/07/27/silk-brocade			"Kit came slamming through the glass door after lunch, in the middle of telling some crazy story, screaming with laughter, half cut already, with a couple of men friends in tow. Ann was just starting on the lining for the lilac suit. One of the friends was a medic, Ray, Kit’s current boyfriend, or he thought he was—Ann knew about other things, one married man in particular. The second friend was also a medic. Ann hadn’t seen him before: Donny Ross, who played the piano, apparently, in a jazz band. Donny Ross had a body as thin as a whip and cavernous cheeks and thick jet-black hair with a long quiff that flopped into his eyes. His mouth was small and his grin was surprisingly girlish, showing his small teeth, though he didn’t grin much—or say much. He was mostly saturnine and judgmental. It was obvious to Ann right away that Donny didn’t like Kit. He saw through her bossy know-how and the whole parade of her snobbery: going on about how Proust was her favorite author and her mother used to have her hats made on the Champs-Élysées and weren’t the little bureaucrats who wanted our taxes so ghastly—as if she couldn’t guess what Ann had guessed already, that Donny was a socialist."
Silk Brocade	http://www.newyorker.com/magazine/2015/07/27/silk-brocade			"“What happened to your leg, old man?” Ray asked."
Silk Brocade	http://www.newyorker.com/magazine/2015/07/27/silk-brocade			"“Which, in a funny way, you could say he was,” Donny Ross said."
Silk Brocade	http://www.newyorker.com/magazine/2015/07/27/silk-brocade			"Ann wondered whether Nola Higgins was impressed by the glamorous new style of her life or simply accepted it, as calmly as she’d have accepted any place she walked into. She must have seen some things during the course of her work as a nurse, some of them horrors. Nola’s home perm made her look closer to their mothers’ age; the dark curls were too tight and flat against her head, and when she sat down she tugged her skirt over her knees, as if she were self-conscious about her broad hips. But her brown eyes were very alert and steady, and she had the kind of skin that was so soft it looked almost loose on her bones, matte pink, as if she were wearing powder, though she wasn’t."
Silk Brocade	http://www.newyorker.com/magazine/2015/07/27/silk-brocade			"Blaise Perney—who opened the side door himself, promptly, as if he’d been waiting for them—wasn’t in the least what they’d prepared for. To begin with, he looked younger than Nola: very tall and ugly, diffident and smiling and stooped, with a long bony face and hair like crinkled pale silk. He welcomed them effusively, blushing as if they were doing him a favor, and said that he was so looking forward to getting to know them. Ann thought with relief that Blaise could easily be won over; she always made this assessment, when she first met men, of whether or not she could get around them if she chose to test her power. Charlie, for instance—although he liked her and flirted with her madly—she could never have deflected from his own path in a million years, whereas Ray was a walkover. Blaise said that Nola was packing a picnic in the kitchen. He led them through a succession of shadowy, chilly, gracious rooms with shuttered windows, apologizing for the mess and the state of decay: his dragging foot seemed to be part of his diffidence."
Silk Brocade	http://www.newyorker.com/magazine/2015/07/27/silk-brocade			"Ann really was convinced that if you could only find the right clothes you could become whatever you wanted, you could transform yourself. She let the heavy fabric fall out of its folds and made Nola stand up, then held it against her in front of the cheval mirror, pulling it in around her waist, frowning expertly at Nola’s reflection across her shoulder, tugging and smoothing the cloth as if she were molding something. “You see? The off-white is very flattering against your dark hair and your lovely skin. There isn’t enough for a whole dress if you want full length, but I think we could get a fitted bodice and a little peplum out of it and find a matching plain fabric for the skirt. With your full figure you want to go for a nice clean silhouette, nothing fussy. This could look stunning, actually.”"
Silk Brocade	http://www.newyorker.com/magazine/2015/07/27/silk-brocade			"She told Kit about Nola’s wedding then; best to get it over with while she was in this mood, and there was company. “I know it’s not exactly our style,” she said. “But we could do with the work.”"
Silk Brocade	http://www.newyorker.com/magazine/2015/07/27/silk-brocade			"Sally and her mother were absorbed together that summer in projects of transformation, changing their clothes or their rooms or themselves. Sally stood over the soup of murky cold-dye in the old washing-up bowl, watching for the blisters of fabric to erupt above the surface, prodding them down with the stained handle of a wooden spoon, feeling hopeful in spite of everything. She wasn’t beautiful like her mother, but Ann made her feel that there was a way around that. Ann always had a plan—and Sally yielded to the gifted, forceful hands that came plucking at her eyebrows or twisting up her hair, whipping the tape measure around her waistline. The jacket was a success: Sally wore it a lot, unbuttoned over T-shirts and jeans. They both dieted, and her mother lost a stone; she’d never looked so lovely. Ann got a babysitter and went out to parties with spare knickers and a toothbrush in her handbag, but came home alone. At the end of the summer, their father moved back in again."
Silk Brocade	http://www.newyorker.com/magazine/2015/07/27/silk-brocade			"These were private rooms, not open to the public, not arranged to look like scenes from the past but with the past and the present simply jumbled together: a cheap little wireless set balanced on a pile of leather-bound books, a milkman’s calendar among the silver-framed photos on a desk whose rolltop was broken, an ordinary electric fire in a huge marble fireplace dirty with wood ash. Ann found this much more romantic; it set her imagination racing. What she could have done with this place if it were hers! In the cavernous, dark kitchen, where the giant-sized iron range was cold and there were fifty dinner plates in a wooden rack, Nola was boiling eggs on a Baby Belling, looking surprisingly at home. Ann’s envy was only fleeting—it was benevolent, gracious. Whatever lay ahead for her, she thought, was better than any house."
Silk Brocade	http://www.newyorker.com/magazine/2015/07/27/silk-brocade			"And then she had to break off, because her eyes brimmed with tears and a red heat came into her cheeks; Ann had an intuition that the flush ran thrillingly all over her body. Who’d have thought that Nola Higgins would be susceptible to that kind of thrill? She was bending over her handbag, fishing for a handkerchief. “How silly,” she said. “It’s ridiculous, Ann. But I’m just so happy. I can’t quite believe that I’m saying those words, that we’re really going to be married. He’s such a lovely chap. And he’ll be able to pay your prices. I knew you wouldn’t be cheap.”"
Silk Brocade	http://www.newyorker.com/magazine/2015/07/27/silk-brocade			"They had not, after all, gone back inside Thwaite House to look in the cedarwood presses. No one had had any appetite, in the intensity of their present, for the past. When they had parted finally, because the medics were on night duty and had to get back, they all made passionate promises to return. The next time they came, Blaise said, he would show them everything. They couldn’t wait, they told him. Soon. That was in 1953."
Silk Brocade	http://www.newyorker.com/magazine/2015/07/27/silk-brocade			"“Do you think so?” Nola’s eyes, doubting and trusting, looked out from the reflection into hers."
Silk Brocade	http://www.newyorker.com/magazine/2015/07/27/silk-brocade			"Eventually, they decided on something classic, full-length, very simple, skimming Nola’s figure without hugging it. Ann would use the brocade that Nola had brought for the bodice and the sleeves, and a matching silk satin, if they could find it, for the skirt. “Unless there’s any more of the brocade?”"
Silk Brocade	http://www.newyorker.com/magazine/2015/07/27/silk-brocade			"Someone came down the steps to the side entrance, then tapped on the opaque glass panes of the door; Ann looked up, irritated at being interrupted. Kit said that they should always switch over to the Third Programme when clients came—it was more sophisticated—but there wasn’t time, and Ann could make out enough through the bubbled glass to know that the woman standing on the other side wasn’t sophisticated anyway. She was too bulky, planted there too stolidly, with an unassuming patience. Some clients pushed their faces up against the door and rattled the handle if they were kept waiting for even a moment."
